{
  "schemaVersion": 1,
  "type": "group",
  "groupKey": "english",
  "label": "オンラインゲームを通じた英語学習の可能性",
  "htmlPath": "pages/groups/english.html",
  "goalHtml": "<p></p>",
  "whatHtml": "<p></p>",
  "whyHtml": "<p></p>",
  "howHtml": "<p></p>",
  "resultHtml": "<p></p>",
  "attachments": [],
  "updatedAt": "2026-09-15T00:00:00+09:00",
  "updatedBy": "system-process-a"
}
