{
  "schemaVersion": 1,
  "type": "group",
  "groupKey": "site",
  "label": "サイト作成",
  "htmlPath": "pages/about_This_Site.html",
  "goalHtml": "<p>Asobi Lab. 公式サイトを開発・運営し、メンバーが使いやすい形に整える。</p>",
  "whatHtml": "<p></p>",
  "whyHtml": "<p></p>",
  "howHtml": "<p></p>",
  "resultHtml": "<p>メンバー・グループのページは、ログイン後の CMS から編集できます。</p>",
  "attachments": [],
  "updatedAt": "2026-09-15T00:00:00+09:00",
  "updatedBy": "system-process-a"
}
