{
  "schemaVersion": 1,
  "type": "group",
  "groupKey": "skate",
  "label": "スケボーの技術向上とそのための思考",
  "htmlPath": "pages/groups/skate.html",
  "goalHtml": "<p>エキスポで動画を発表できる状態にする。スケボーの技を撮影してかっこいいPVを作る。</p>",
  "whatHtml": "<p>素人が半年でスケボーをどれだけうまくなれるか</p>",
  "whyHtml": "<p>スケボーをしたかったから。前期の探求で楽しさに気づき、より深くやりたくなった。</p>",
  "howHtml": "<p>とにかく練習する。動画を撮影し、互いにフィードバックする。</p>",
  "resultHtml": "<p></p>",
  "attachments": [],
  "updatedAt": "2026-09-15T00:00:00+09:00",
  "updatedBy": "system-process-b"
}
