{
  "schemaVersion": 1,
  "type": "group",
  "groupKey": "fashion",
  "label": "ファッションについて",
  "htmlPath": "pages/groups/fashion.html",
  "goalHtml": "人が感じる\"おしゃれ\"の感覚を明確にする",
  "whatHtml": "人が直感的におしゃれだと感じるのはなぜか",
  "whyHtml": "<p>日常生活で感じた、自然と出てくる「あの人おしゃれ」という感情に疑問を感じたから</p>",
  "howHtml": "<p>色んな人の考えを調査して情報を集め、共通点を見出し考察する</p>",
  "resultHtml": "\"おしゃれ\"と感じるのは、3つの要因から成り立っている。<p></p><div>根本的な部分・人為的な部分・知識の部分</div>",
  "attachments": [],
  "updatedAt": "2026-10-02T03:36:28.551Z",
  "updatedBy": "HnKYa"
}
